"DC COMICS","Funko POP Diana W/Arrow 1124 Zack Snyder's Justice League","https://bellascositas.es/18198-home_default/funko-pop-diana-warrow-1124-zack-snyder-s-justice-league.jpg","11,86 €","Zack Snyder's Justice League Figura POP! Vinyl Diana w/Arrow 9 cm."
"DC COMICS","Funko POP Wonder Woman Classic With Cape 433 DC Comics WW80th","https://bellascositas.es/18758-home_default/funko-pop-wonder-woman-classic-with-cape-433-dc-comics-ww80th.jpg","11,86 €","POP Heroes: WW 80th - WW (ClassicW/Cape)"
"DC COMICS","Funko POP Huntress Cazadora 305 Birds Of Prey","https://bellascositas.es/6088-home_default/funko-pop-huntress-cazadora-305-birds-of-prey.jpg","11,86 €","Figura POP DC Birds of Prey Huntress Aves de Presa"
"DC COMICS","Funko POP Ride Selina Kyle On Motorcycle 281 DC The Batman","https://bellascositas.es/20197-home_default/funko-pop-ride-selina-kyle-on-motorcycle-281-dc-the-batman.jpg","29,71 €","POP Ride DLX: Selina on Motorcycle"
"DC COMICS","Funko POP Batman 1187 DC The Batman","https://bellascositas.es/20155-home_default/funko-pop-batman-1187-dc-the-batman.jpg","12,71 €","POP Movies: Batman"
"DC COMICS","Funko POP ﻿The Riddler 1192 DC The Batman","https://bellascositas.es/20181-home_default/funko-pop-the-riddler-1192-dc-the-batman.jpg","12,71 €","POP Movies: The Riddler"
"DC COMICS","Funko POP ﻿Oswald Cobblepot 1191 DC The Batman Regular + Chase","https://bellascositas.es/20176-home_default/funko-pop-oswald-cobblepot-1191-dc-the-batman-regular-chase.jpg","52,66 €","POP Movies: Oswald Cobblepot Regular + Chase"
"DC COMICS","Funko POP ﻿Oswald Cobblepot 1191 DC The Batman","https://bellascositas.es/20172-home_default/funko-pop-oswald-cobblepot-1191-dc-the-batman.jpg","12,71 €","POP Movies: Oswald Cobblepot"
"DC COMICS","Funko POP Selina Kyle 1190 DC The Batman Regular + Chase","https://bellascositas.es/20167-home_default/funko-pop-selina-kyle-1190-dc-the-batman-regular-chase.jpg","52,66 €","POP Movies: Selina Kyle Regular + Chase"
"DC COMICS","Funko POP Selina Kyle 1190 DC The Batman","https://bellascositas.es/20163-home_default/funko-pop-selina-kyle-1190-dc-the-batman.jpg","12,71 €","POP Movies: Selina Kyle"
"DC COMICS","Funko POP Yara Flor SE DC Future State","https://bellascositas.es/17841-home_default/funko-pop-yara-flor-se-dc-future-state.jpg","11,86 €","Funko POP Heroes: PWP Youthtrust - Yara Flor"
"DC COMICS","Funko POP Superman 159 DC Comics 25 Cm. Special Edition","https://bellascositas.es/19882-home_default/funko-pop-superman-159-dc-comics-25-cm-special-edition.jpg","46,71 €","POP Heroes: Superman 10"" Special Edition"
"DC COMICS","Funko POP Wonder Woman Odyssey 405 DC Comics WW80th","https://bellascositas.es/18752-home_default/funko-pop-wonder-woman-odyssey-405-dc-comics-ww80th.jpg","12,71 €","POP Heroes: WW 80th - WW (Odyssey)"
"DC COMICS","Funko POP Wonder Woman White Lantern 423 DC Comics WW80th","https://bellascositas.es/18744-home_default/funko-pop-wonder-woman-white-lantern-423-dc-comics-ww80th.jpg","12,71 €","POP Heroes: WW 80th - WW (White Lantern)"
"DC COMICS","Funko POP Wonder Woman ATwistOfFate 406 DC Comics WW80th","https://bellascositas.es/19719-home_default/funko-pop-wonder-woman-atwistoffate-406-dc-comics-ww80th.jpg","12,71 €","POP Heroes: WW 80th - WW (ATwistOfFate)"
"DC COMICS","Funko POP Bane 412 DC El Dia De Los Muertos","https://bellascositas.es/19646-home_default/funko-pop-bane-412-dc-el-dia-de-los-muertos.jpg","11,86 €","Dia De Los DC Figura POP! Vinyl Bane 9 cm"
"DC COMICS","Funko POP Wonder Woman 167 DC Bombshell BC Awareness","https://bellascositas.es/17857-home_default/funko-pop-wonder-woman-167-dc-bombshell-bc-awareness.jpg","12,71 €","POP Heroes: BC Awareness - Bombshell Wonder Woman"
"DC COMICS","Funko POP Supergirl 222 DC Bombshell BC Awareness","https://bellascositas.es/17853-home_default/funko-pop-supergirl-222-dc-bombshell-bc-awareness.jpg","12,71 €","POP Heroes: BC Awareness - Bombshell Supergirl"
"DC COMICS","Funko POP Catwoman 225 DC Bombshell BC Awareness","https://bellascositas.es/17845-home_default/funko-pop-catwoman-225-dc-bombshell-bc-awareness.jpg","12,71 €","POP Heroes: BC Awareness -Bombshell Catwoman"
"DC COMICS","Funko POP Aquaman Silueta 16 Liga De La Justicia DC Comics GITD Exclusive","https://bellascositas.es/3199-home_default/funko-pop-aquaman-silueta-16-liga-de-la-justicia-dc-comics-gitd-exclusive.jpg","15,26 €","Figura Vinilo FUNKO POP de tus personajes favoritos de DC COMICS JUSTICE LEAGUE Funko Pop AQUAMAN GLOW IN THE DARK EXCLUSIVE"
"DC COMICS","Funko POP Blue Beetle 410 DC El Dia De Los Muertos","https://bellascositas.es/19313-home_default/funko-pop-blue-beetle-410-dc-el-dia-de-los-muertos.jpg","11,86 €","Dia De Los DC Figura POP! Vinyl Blue Beetle 9 cm"
"DC COMICS","Funko POP Harley Quinn 413 DC El Dia De Los Muertos","https://bellascositas.es/19311-home_default/funko-pop-harley-quinn-413-dc-el-dia-de-los-muertos.jpg","11,86 €","Dia De Los DC Figura POP! Vinyl Harley Quinn 9 cm"
"DC COMICS","Funko POP Superman BC Awareness 349 DC Super Héroes","https://bellascositas.es/9618-home_default/funko-pop-superman-bc-awareness-349-dc-super-heroes.jpg","11,86 €","DC Comics Figura POP! Heroes Vinyl BC Awareness - Superman 9 cm"
"DC COMICS","Funko POP Polka-Dot Man 1112 The Suicide Squad","https://bellascositas.es/17367-home_default/funko-pop-polka-dot-man-1112-the-suicide-squad.jpg","11,86 €","POP Movies: The Suicide Squad Polka-Dot Man"
"DC COMICS","Funko POP Wile E. Coyote As Cyborg 866 DC Looney Tunes Special Edition","https://bellascositas.es/18428-home_default/funko-pop-wile-e-coyote-as-cyborg-866-dc-looney-tunes-special-edition.jpg","17,95 €","DC Looney Tunes POP! Television Vinyl Figura Wile E. Coyote as Cyborg 9 cm 80 Years of Bugs Bunny"
"DC COMICS","Funko POP Darkseid 1126 Zack Snyder's Justice League","https://bellascositas.es/18496-home_default/funko-pop-darkseid-1126-zack-snyder-s-justice-league.jpg","11,86 €","Zack Snyder's Justice League Figura POP! Vinyl Darkseid 9 cm."
"DC COMICS","Funko POP Wonder Woman Challenge Of The Gods 390 DC Comics WW80th","https://bellascositas.es/14426-home_default/funko-pop-wonder-woman-challenge-of-the-gods-390-dc-comics-ww80th.jpg","11,86 €","DC Comics Figura POP! Heroes Vinyl WW 80th - WW (Challenge Of The Gods) 9 cm"
"DC COMICS","Funko POP Wonder Woman Superman Red Son 392 DC Comics Wonder Woman 80th","https://bellascositas.es/17871-home_default/funko-pop-wonder-woman-superman-red-son-392-dc-comics-wonder-woman-80th.jpg","11,86 €","DC Comics Figura POP! Heroes Vinyl WW 80th - WW (Superman: Red Son) 9 cm"
"DC COMICS","Funko POP Wonder Woman Black Lantern 393 DC Comics Wonder Woman 80th","https://bellascositas.es/17870-home_default/funko-pop-wonder-woman-black-lantern-393-dc-comics-wonder-woman-80th.jpg","11,86 €","DC Comics Figura POP! Heroes Vinyl WW 80th - WW (Black Lantern) 9 cm"
"DC COMICS","Funko POP Peacemaker 1110 The Suicide Squad","https://bellascositas.es/17351-home_default/funko-pop-peacemaker-1110-the-suicide-squad.jpg","11,86 €","POP Movies: The Suicide Squad Peacemaker"
"DC COMICS","Funko POP Wonder Woman Golden Armor 329 DC Wonder Woman 1984 Special Edition","https://bellascositas.es/17503-home_default/funko-pop-wonder-woman-golden-armor-329-dc-wonder-woman-1984-special-edition.jpg","15,26 €","Wonder Woman 1984 Movie POP! Movies Vinyl Figura Wonder Woman Golden Armor Special Edition"
"DC COMICS","Funko POP Joker 375 DC Comics Imperial Palace","https://bellascositas.es/16128-home_default/funko-pop-joker-375-dc-comics-imperial-palace.jpg","11,86 €","DC Comics Imperial Palace POP! Icons Vinyl Figura Joker 9 cm"
"DC COMICS","Funko POP Batman 374 DC Comics Imperial Palace","https://bellascositas.es/16127-home_default/funko-pop-batman-374-dc-comics-imperial-palace.jpg","11,86 €","DC Comics Imperial Palace POP! Icons Vinyl Figura Batman 9 cm"
"DC COMICS","Funko POP Robin 377 DC Comics Imperial Palace","https://bellascositas.es/16129-home_default/funko-pop-robin-377-dc-comics-imperial-palace.jpg","11,86 €","DC Comics Imperial Palace POP! Icons Vinyl Figura Robin 9 cm"
"DC COMICS","Funko POP Killer Frost 1098 DC Comics The Flash","https://bellascositas.es/14438-home_default/funko-pop-killer-frost-1098-dc-comics-the-flash.jpg","11,86 €","The Flash Figura POP! Heroes Vinyl Killer Frost 9 cm"
"DC COMICS","Funko POP Green Lantern 317 Heroes Green Lantern Specialty Series","https://bellascositas.es/15738-home_default/funko-pop-green-lantern-317-heroes-green-lantern-specialty-series.jpg","18,66 €","DC POP! Heroes Vinyl Figura Green Lantern 9 cm Specialty Series"
"DC COMICS","Funko POP Cyborg Silueta 95 Liga De La Justicia DC Comics Exclusive GITD","https://bellascositas.es/6018-home_default/funko-pop-cyborg-silueta-95-liga-de-la-justicia-dc-comics-exclusive-gitd.jpg","15,26 €","Figura POP DC Comics Justice League Cyborg Silhouette Exclusive Glow in the dark"
"DC COMICS","Funko POP Wonder Woman Silueta 08 DC Super Héroes GITD Exclusive","https://bellascositas.es/1695-home_default/funko-pop-wonder-woman-silueta-08-dc-super-heroes-gitd-exclusive.jpg","14,41 €","Figuras Pop! Vinyl tus personajes favoritos de DC SUPER HEROES Funko POP! WONDER WOMAN SILHOUETTE GITD: Brilla en la oscuridad"
"DC COMICS","Funko POP SR. FRIO Mr. FREEZE 342 Batman & Robin DC Comics","https://bellascositas.es/9430-home_default/funko-pop-sr-frio-mr-freeze-342-batman-robin-dc-comics.jpg","12,71 €","Batman &amp; Robin POP! Heroes Vinyl Figura Mr. Freeze 9 cm"
"DC COMICS","Funko 5 Star Batgirl DC Classic","https://bellascositas.es/3124-home_default/funko-5-star-batgirl-dc-classic.jpg","11,86 €","Figuras 5 Star Vinyl de tus personajes favoritos de DC CLASSICS Funko Pop BATGIRL"
"DC COMICS","Funko POP Catwoman Sepia 225 DC Comics Bombshells Exclusive","https://bellascositas.es/5820-home_default/funko-pop-catwoman-sepia-225-dc-comics-bombshells-exclusive.jpg","15,26 €","Figura POP DC Comics Bombshells Catwoman Sepia Exclusive"
"DC COMICS","Llavero Pocket POP Batman Holiday DC Comics","https://bellascositas.es/2132-home_default/llavero-pocket-pop-batman-holiday-dc-comics.jpg","6,80 €","Llavero Pocket POP! Keychain BATMAN HOLIDAY DC Comics"
"DC COMICS","Funko POP Kyle Rainer White Lantern 237 DC Super Héroes GITD","https://bellascositas.es/13753-home_default/funko-pop-kyle-rainer-white-lantern-237-dc-super-heroes-gitd.jpg","16,96 €","DC Comics Figura POP! Heroes Vinyl Kyle Rayner 9 cm Glow in the dark"
"DC COMICS","Funko POP Ra's Al Ghul 345 Batman DC Heroes Exclusive SDCC2020","https://bellascositas.es/13648-home_default/funko-pop-ra-s-al-ghul-345-batman-dc-heroes-exclusive-sdcc2020.jpg","23,76 €","Batman POP! Heroes Vinyl Figura Ra's Al Ghul 9 cm Exclusive SDCC 2020"
"DC COMICS","Funko POP The Joker 337 Batman 1989 DC Comics CHASE","https://bellascositas.es/9422-home_default/funko-pop-the-joker-337-batman-1989-dc-comics-chase.jpg","42,46 €","Batman 1989 POP! Heroes Vinyl Figuren Joker 9 cm Limited CHASE Edition"
"ANIME / MANGA","Funko POP Orochimaru 729 Naruto Shippuden","https://bellascositas.es/7450-home_default/funko-pop-orochimaru-729-naruto-shippuden.jpg","16,96 €","Naruto Figura POP! Animation Vinyl Orochimaru 9 cm"
"ANIME / MANGA","Funko POP Himiko Toga 787 My Hero Academia","https://bellascositas.es/16049-home_default/funko-pop-himiko-toga-787-my-hero-academia.jpg","13,56 €","My Hero Academia Figura POP! Animation Vinyl Himiko Toga w/Face Cover 9 cm"
"ANIME / MANGA","Funko POP Mirio Togata In Hero Costume 1004 My Hero Academia","https://bellascositas.es/18353-home_default/funko-pop-mirio-togata-in-hero-costume-1004-my-hero-academia.jpg","12,71 €","POP Animation: MHA - Mirio in Hero Costume"
"ANIME / MANGA","Funko POP Kakashi 182 Naruto Shippuden","https://bellascositas.es/3268-home_default/funko-pop-kakashi-182-naruto-shippuden.jpg","25,46 €","Figura Vinilo FUNKO POP de tus personajes favoritos de NARUTO SHIPPUDEN KAKASHI"
"ANIME / MANGA","Funko POP Pain 934 Naruto","https://bellascositas.es/15360-home_default/funko-pop-pain-934-naruto.jpg","16,96 €","Naruto Figura POP! Animation Vinyl Pain 9 cm"
"ANIME / MANGA","Funko POP Dr. Gero 950 Dragon Ball Z Serie 9","https://bellascositas.es/20447-home_default/funko-pop-dr-gero-950-dragon-ball-z-serie-9.jpg","13,56 €","Dragon Ball Z Serie 9 Figura POP! Animation Vinyl Dr. Gero 9 cm"
"ANIME / MANGA","Funko POP Pegasus Seiya 806 Saint Seiya Caballeros Del Zodiáco","https://bellascositas.es/13095-home_default/funko-pop-pegasus-seiya-806-saint-seiya-caballeros-del-zodiaco.jpg","13,56 €","Saint Seya Figura POP! Animation Vinyl Pegasus Seiya 9 cm"
"ANIME / MANGA","Funko POP Hercule 812 Dragon Ball Super Serie 4","https://bellascositas.es/10651-home_default/funko-pop-hercule-812-dragon-ball-super-serie-4.jpg","8,00 €","Dragon Ball Super Figura POP! Animation Vinyl Hercule 9 cm"
"ANIME / MANGA","Funko POP Future Mai 817 Dragon Ball Super Serie 4","https://bellascositas.es/10669-home_default/funko-pop-future-mai-817-dragon-ball-super-serie-4.jpg","11,86 €","Dragon Ball Super Figura POP! Animation Vinyl Future Mai 9 cm"
"ANIME / MANGA","Funko POP Kami 952 Dragon Ball Z Serie 9","https://bellascositas.es/19192-home_default/funko-pop-kami-952-dragon-ball-z-serie-9.jpg","11,86 €","Dragon Ball Z Serie 9 Figura POP! Animation Vinyl Kami 9 cm"
"ANIME / MANGA","Funko POP Goku & Flying Nimbus 109 Dragon Ball Z","https://bellascositas.es/737-home_default/funko-pop-goku-flying-nimbus-109-dragon-ball-z.jpg","15,26 €","Figura de Vinilo de 9 cm. aprox. en caja con ventana."
"ANIME / MANGA","Funko POP Izuku Mirodiya Deku 603 My Hero Academia","https://bellascositas.es/5848-home_default/funko-pop-izuku-mirodiya-deku-603-my-hero-academia.jpg","15,26 €","Figura Funko Pop! Vinilo tus personajes favoritos de MY HERO ACADEMIA DEKU CON CASCO"
"ANIME / MANGA","Funko POP Yami Bakura 1061 Yu-Gi-Oh","https://bellascositas.es/19334-home_default/funko-pop-yami-bakura-1061-yu-gi-oh.jpg","12,71 €","POP Deluxe: Yu-Gi-Oh - Yami Bakura"
"ANIME / MANGA","Funko POP Mai Valentine 1060 Yu-Gi-Oh","https://bellascositas.es/19330-home_default/funko-pop-mai-valentine-1060-yu-gi-oh.jpg","12,71 €","POP Deluxe: Yu-Gi-Oh - Mai Valentine"
"ANIME / MANGA","Funko POP Eri 1011 My Hero Academia","https://bellascositas.es/18345-home_default/funko-pop-eri-1011-my-hero-academia.jpg","12,71 €","POP Animation: MHA - Eri"
"ANIME / MANGA","Funko POP Ryukyu In Hero Costume 1007 My Hero Academia","https://bellascositas.es/18365-home_default/funko-pop-ryukyu-in-hero-costume-1007-my-hero-academia.jpg","12,71 €","POP Animation: MHA - Ryukyu in Hero Costume"
"ANIME / MANGA","Funko POP Eijiro Unbreakable 1009 My Hero Academia","https://bellascositas.es/18373-home_default/funko-pop-eijiro-unbreakable-1009-my-hero-academia.jpg","12,71 €","POP Animation: MHA - Eijiro Unbreakable"
"ANIME / MANGA","Funko POP Sasuke 72 Naruto","https://bellascositas.es/3226-home_default/funko-pop-sasuke-72-naruto.jpg","15,26 €","Figura Vinilo FUNKO POP de tus personajes favoritos de NARUTO SASUKE"
"ANIME / MANGA","Funko POP Dragon Shiryu 807 Saint Seiya Caballeros Del Zodiáco","https://bellascositas.es/13091-home_default/funko-pop-dragon-shiryu-807-saint-seiya-caballeros-del-zodiaco.jpg","13,56 €","Saint Seya Figura POP! Animation Vinyl Dragon Shiryu 9 cm"
"ANIME / MANGA","Funko POP Leorio 700 Hunter X Hunter","https://bellascositas.es/16097-home_default/funko-pop-leorio-700-hunter-x-hunter.jpg","11,86 €","Hunter x Hunter Figura POP! Vinyl Leorio 9 cm"
"ANIME / MANGA","Funko POP Minato Namikaze 935 Naruto","https://bellascositas.es/15356-home_default/funko-pop-minato-namikaze-935-naruto.jpg","15,26 €","Naruto Figura POP! Animation Vinyl Minato Namikaze 9 cm"
"ANIME / MANGA","Funko POP Super Hercule 818 Dragon Ball Super Serie 4 GLOW Specialty Series","https://bellascositas.es/15411-home_default/funko-pop-super-hercule-818-dragon-ball-super-serie-4-glow-specialty-series.jpg","13,56 €","Dragon Ball Super Figura POP! Animation Vinyl Super Saiyan Hercule Glow 9 cm Specialty Series"
"ANIME / MANGA","Funko POP Majin Buu Evil 864 Dragon Ball Z","https://bellascositas.es/13442-home_default/funko-pop-majin-buu-evil-864-dragon-ball-z.jpg","11,86 €","Dragon Ball Z Figura POP! Animation Vinyl Evil Buu 9 cm"
"ANIME / MANGA","Funko POP Bulma 707 Dragon Ball Z","https://bellascositas.es/5864-home_default/funko-pop-bulma-707-dragon-ball-z.jpg","11,86 €","Figura Funko Pop! Vinilo tus personajes favoritos de DRAGON BALL Z - BULMA"
"ANIME / MANGA","Funko POP Super Hercule 818 Dragon Ball Super Serie 4 GLOW Special Edition","https://bellascositas.es/15387-home_default/funko-pop-super-hercule-818-dragon-ball-super-serie-4-glow-special-edition.jpg","13,56 €","Dragon Ball Super Figura POP! Animation Vinyl Super Saiyan Hercule Glow 9 cm Special Edition"
"ANIME / MANGA","Funko POP Souichi Tsujii 912 Junji Ito","https://bellascositas.es/15545-home_default/funko-pop-souichi-tsujii-912-junji-ito.jpg","11,86 €","Junji Ito Figura POP! Animation Vinyl Souichi Tsujii 9 cm"
"ANIME / MANGA","Funko POP Miss Fuchi 913 Junji Ito","https://bellascositas.es/15487-home_default/funko-pop-miss-fuchi-913-junji-ito.jpg","11,86 €","Junji Ito Figura POP! Animation Vinyl Ms. Fuchi 9 cm"
"ANIME / MANGA","Funko POP Super Saiyan Caulifla 816 Dragon Ball Super Serie 4","https://bellascositas.es/14723-home_default/funko-pop-super-saiyan-caulifla-816-dragon-ball-super-serie-4.jpg","11,86 €","Dragon Ball Super Figura POP! Animation Vinyl Super Saiyan Caulifla 9 cm"
