"MARVEL","Funko POP Carnage 889 Marvel Venom 2","https://bellascositas.es/15922-home_default/funko-pop-carnage-889-marvel-venom-2.jpg","13,56 €","Marvel Venom: Let There Be Carnage Figura POP! Vinyl Carnage 9 cm"
"MARVEL","Funko POP Ego 205 Marvel Guardianes De La Galaxia Vol.2","https://bellascositas.es/20775-home_default/funko-pop-ego-205-marvel-guardianes-de-la-galaxia-vol2-.jpg","15,26 €","Figura Vinilo FUNKO POP de tus personajes favoritos de MARVEL GUARDIANES DE LA GALAXIA VOL. 2 - Ego"
"MARVEL","Funko POP Logan 647 Marvel X-Men 20th","https://bellascositas.es/8263-home_default/funko-pop-logan-647-marvel-x-men-20th.jpg","15,26 €","X-Men 20th Anniversary POP! Marvel Vinyl Figura Logan 9 cm"
"MARVEL","Funko POP Corvus Glaive 290 Marvel Avengers Infinity War","https://bellascositas.es/20553-home_default/funko-pop-corvus-glaive-290-marvel-avengers-infinity-war.jpg","21,21 €","Avengers Infinity War Figura POP! Movies Vinyl Corvus Glaive"
"MARVEL","Funko POP Tony Stark 449 Avengers Endgame Marvel","https://bellascositas.es/1024-home_default/funko-pop-tony-stark-449-avengers-endgame-marvel.jpg","15,26 €","Figuras Pop! Vinyl de tus personajes favoritos de AVENGERS ENDGAME MARVEL Funko Pop TONY STARK"
"MARVEL","Funko POP Capitán América Escudo Roto Y Mjolnir 573 Marvel Vengadores Endgame","https://bellascositas.es/4563-home_default/funko-pop-capitan-america-escudo-roto-y-mjolnir-573-marvel-vengadores-endgame.jpg","23,76 €","Avengers: Endgame POP! Movies Vinyl Figura Captain America w/Broken Shield &amp; Mjölnir 9 cm"
"MARVEL","Funko POP I Am Iron Man 580 Marvel Vengadores Endgame GITD Special Edition","https://bellascositas.es/14488-home_default/funko-pop-i-am-iron-man-580-marvel-vengadores-endgame-gitd-special-edition.jpg","42,46 €","Avengers: Endgame POP! Movies Vinyl Figura I Am Iron Man (MT) (GW) 9 cm"
"MARVEL","Funko POP Zombie Hunter Spidey Sin Máscara 947 Marvel What If Special Edition","https://bellascositas.es/20465-home_default/funko-pop-zombie-hunter-spidey-sin-mascara-947-marvel-what-if-special-edition.jpg","25,46 €","POP Marvel: What If - Zombie Hunter Spidey"
"MARVEL","Funko POP Spider-Girl 955 Marvel Especial Edition","https://bellascositas.es/20461-home_default/funko-pop-spider-girl-955-marvel-especial-edition.jpg","24,61 €","POP Marvel: Marvel- Spider-Girl"
"MARVEL","Funko POP Deluxe Iron Man With Gantry Mark IV 905 Iron Man 2 Marvel GITD Special Edition","https://bellascositas.es/20456-home_default/funko-pop-deluxe-iron-man-with-gantry-mark-iv-905-iron-man-2-marvel-gitd-special-edition.jpg","55,21 €","Si estás buscando comprar un Funko de Iron Man, en Bellascositas tenemos esta figura de edición especial de Iron Man, el poderoso Vengador."
"MARVEL","Funko POP Stan Lee Hugh Hefner Cameo 656 Iron Man Marvel Exclusive SDCC2020","https://bellascositas.es/11082-home_default/funko-pop-stan-lee-hugh-hefner-cameo-656-iron-man-marvel-exclusive-sdcc2020.jpg","30,95 €","Figura Vinilo FUNKO POP de tus personajes favoritos de STAN LEE CAMEO HUGH HEFNER IRON MAN SDCC 2020 EXCLUSIVE"
"MARVEL","Funko POP Bishop 919 Marvel X-Men Special Edition","https://bellascositas.es/19610-home_default/funko-pop-bishop-919-marvel-x-men-special-edition.jpg","21,21 €","Marvel X-Men POP! Marvel Vinyl Figura Bishop Special Edition"
"MARVEL","Funko POP Magik 920 Marvel X-Men Special Edition","https://bellascositas.es/19614-home_default/funko-pop-magik-920-marvel-x-men-special-edition.jpg","21,21 €","Marvel X-Men POP! Marvel Vinyl Figura Magik Special Edition"
"MARVEL","Funko POP Gilgamesh 730 Marvel Eternals","https://bellascositas.es/20001-home_default/funko-pop-gilgamesh-730-marvel-eternals.jpg","11,86 €","POP Marvel: Eternals - Gilgamesh"
"MARVEL","Funko POP Kingo 731 Marvel Eternals","https://bellascositas.es/17892-home_default/funko-pop-kingo-731-marvel-eternals.jpg","11,86 €","POP Marvel: Eternals - Kingo"
"MARVEL","Funko POP Classic Loki 902 Loki Special Edition","https://bellascositas.es/18694-home_default/funko-pop-classic-loki-902-loki-special-edition.jpg","28,01 €","POP Marvel: Loki - Classic Loki Special Edtion"
"MARVEL","Funko POP Zombie Falcon 942 Marvel What If","https://bellascositas.es/18605-home_default/funko-pop-zombie-falcon-942-marvel-what-if.jpg","11,86 €","POP Marvel: What If - Zombie Falcon"
"MARVEL","OUTLET Funko POP T'Challa Star-Lord 871 Marvel What If","https://bellascositas.es/17484-home_default/outlet-funko-pop-t-challa-star-lord-871-marvel-what-if.jpg","10,00 €","POP Marvel: What If - T'Challa Star-Lord"
"MARVEL","Funko POP Monica Rambeau 825 Marvel WandaVision","https://bellascositas.es/14771-home_default/funko-pop-monica-rambeau-825-marvel-wandavision.jpg","11,86 €","WandaVision POP! TV Vinyl Figura Monica Rambeau 9 cm"
"MARVEL","Funko POP Kro 737 Marvel Eternals","https://bellascositas.es/17925-home_default/funko-pop-kro-737-marvel-eternals.jpg","11,86 €","POP Marvel: Eternals - Kro"
"MARVEL","Funko POP Rogue 644 Pícara Marvel X-Men 20th","https://bellascositas.es/8251-home_default/funko-pop-rogue-644-picara-marvel-x-men-20th.jpg","11,86 €","X-Men 20th Anniversary POP! Marvel Vinyl Figura Rogue 9 cm"
"MARVEL","Funko POP Taskmaster 632 Avengers Marvel Gamerverse","https://bellascositas.es/8163-home_default/funko-pop-taskmaster-632-avengers-marvel-gamerverse.jpg","11,86 €","Marvel Avengers: Taskmaster (Stark Tech Suit) POP Vinyl Bobble-Head by Funko"
"MARVEL","Funko POP Beast Bestia 643 Marvel X-Men 20th","https://bellascositas.es/8223-home_default/funko-pop-beast-bestia-643-marvel-x-men-20th.jpg","11,86 €","X-Men 20th Anniversary POP! Marvel Vinyl Figura Beast 9 cm"
"MARVEL","Funko POP Professor X 641 Profesor Charles Xavier Marvel X-Men 20th","https://bellascositas.es/8247-home_default/funko-pop-professor-x-641-profesor-charles-xavier-marvel-x-men-20th.jpg","11,86 €","X-Men 20th Anniversary POP! Marvel Vinyl Figura Professor X 9 cm"
"MARVEL","Funko POP Ned 925 Spider-Man: No Way Home","https://bellascositas.es/17323-home_default/funko-pop-ned-925-spider-man-no-way-home.jpg","12,71 €","POP Marvel: Spider-Man: No Way Home - Ned"
"MARVEL","Funko POP MJ 924 Spider-Man: No Way Home","https://bellascositas.es/17327-home_default/funko-pop-mj-924-spider-man-no-way-home.jpg","12,71 €","POP Marvel: Spider-Man: No Way Home - MJ"
"MARVEL","Funko POP Deadpool Scooter 48 Marvel Deadpool","https://bellascositas.es/5214-home_default/funko-pop-deadpool-scooter-48-marvel-deadpool.jpg","15,26 €","Figura Funko Pop! Vinilo tus personajes favoritos de MARVEL DEADPOOL - DEADPOLL ON SCOOTER"
"MARVEL","Funko POP Zombie Gambit 788 Marvel Zombies","https://bellascositas.es/15647-home_default/funko-pop-zombie-gambit-788-marvel-zombies.jpg","11,86 €","Marvel Figura POP! Vinyl Zombie Gambit 9 cm"
"MARVEL","Funko POP Venompool 300 Marvel Contest Of Champions Gamerverse","https://bellascositas.es/5861-home_default/funko-pop-venompool-300-marvel-contest-of-champions-gamerverse.jpg","14,41 €","Figuras Pop! Vinyl de tus personajes favoritos de Marvel Contest of Champions VENOMPOOL"
"MARVEL","Funko POP Loki 895 Marvel Loki","https://bellascositas.es/16451-home_default/funko-pop-loki-895-marvel-loki.jpg","12,71 €","Loki POP! Vinyl Figura Loki 9 cm"
"MARVEL","Funko Pocket POP MARVEL Calendario De Adviento (24 Figuras)","https://bellascositas.es/3247-home_default/funko-pocket-pop-marvel-calendario-de-adviento-24-figuras.jpg","56,06 €","Calendario de adviento de MARVEL del año 2019, con 24 figuras Pocket Pop!"
"MARVEL","Funko POP Capitán América 627 Avengers Marvel Gamerverse","https://bellascositas.es/8161-home_default/funko-pop-capitan-america-627-avengers-marvel-gamerverse.jpg","12,71 €","Marvel Avengers: Captain America (Stark Tech Suit) POP Vinyl Bobble-Head by Funko"
"MARVEL","Funko POP Bedtime Deadpool En Bata 327 Marvel Deadpool Parody","https://bellascositas.es/580-home_default/funko-pop-bedtime-deadpool-en-bata-327-marvel-deadpool-parody.jpg","15,26 €","Figura Funko Pop! Vinilo tus personajes favoritos de DEADPOOL PARODY - DEADPOOL IN ROBE"
"MARVEL","Funko POP Deadpool Tumbado 320 Marvel Deadpool Parody","https://bellascositas.es/5219-home_default/funko-pop-deadpool-tumbado-320-marvel-deadpool-parody.jpg","12,71 €","Figura Funko Pop! Vinilo tus personajes favoritos de MARVEL DEADPOOL - DEADPOLL PARODY"
"MARVEL","Funko POP Phastos 736 Marvel Eternals","https://bellascositas.es/17921-home_default/funko-pop-phastos-736-marvel-eternals.jpg","11,86 €","POP Marvel: Eternals - Phastos"
"MARVEL","Funko POP Gingerbread Bruja Escarlata 940 Marvel Holiday","https://bellascositas.es/18029-home_default/funko-pop-gingerbread-bruja-escarlata-940-marvel-holiday.jpg","11,86 €","POP Marvel: Holiday - Scarlet Witch"
"MARVEL","Funko POP Wenwu 847 Marvel Shang-Chi","https://bellascositas.es/15766-home_default/funko-pop-wenwu-847-marvel-shang-chi.jpg","11,86 €","Marvel Shang-Chi POP! Marvel Vinyl Figura Wenwu 9 cm"
"MARVEL","Funko POP Sprite 732 Marvel Eternals","https://bellascositas.es/17901-home_default/funko-pop-sprite-732-marvel-eternals.jpg","11,86 €","POP Marvel: Eternals - Sprite"
"MARVEL","Funko POP Gilgamesh 730 Marvel Eternals Limited CHASE Edition","https://bellascositas.es/17898-home_default/funko-pop-gilgamesh-730-marvel-eternals-limited-chase-edition.jpg","42,46 €","POP Marvel: Eternals - Gilgamesh Limited CHASE Edition"
"MARVEL","Funko POP Sersi 728 Marvel Eternals","https://bellascositas.es/17883-home_default/funko-pop-sersi-728-marvel-eternals.jpg","11,86 €","POP Marvel: Eternals - Sersi"
"MARVEL","Funko POP Ikaris 727 Marvel Eternals","https://bellascositas.es/17879-home_default/funko-pop-ikaris-727-marvel-eternals.jpg","11,86 €","POP Marvel: Eternals - Ikaris"
"MARVEL","Funko POP Mobius 896 Marvel Loki","https://bellascositas.es/16452-home_default/funko-pop-mobius-896-marvel-loki.jpg","11,86 €","Loki POP! Vinyl Figura Mobius 9 cm"
"MARVEL","Funko POP Zombie Iron Man 944 Marvel What If","https://bellascositas.es/18609-home_default/funko-pop-zombie-iron-man-944-marvel-what-if.jpg","11,86 €","POP Marvel: What If - Zombie Iron Man"
"MARVEL","Funko POP Zombie Bruja Escarlata 943 Marvel What If","https://bellascositas.es/18607-home_default/funko-pop-zombie-bruja-escarlata-943-marvel-what-if.jpg","11,86 €","POP Marvel: What If - Scarlet Witch"
"MARVEL","Funko POP Zombie Capitán América 941 Marvel What If","https://bellascositas.es/18574-home_default/funko-pop-zombie-capitan-america-941-marvel-what-if.jpg","11,86 €","POP Marvel: What If - Zombie Captain America"
"MARVEL","Funko POP Gingerbread Black Panther 937 Marvel Holiday","https://bellascositas.es/18017-home_default/funko-pop-gingerbread-black-panther-937-marvel-holiday.jpg","11,86 €","POP Marvel: Holiday - Black Panther"
"MARVEL","Funko POP Gingerbread Hulk 935 Marvel Holiday","https://bellascositas.es/18009-home_default/funko-pop-gingerbread-hulk-935-marvel-holiday.jpg","11,86 €","POP Marvel: Holiday - Hulk"
"MARVEL","Funko POP Iron Hammer 866 25 Cm. Marvel Infinity Warps Special Edition","https://bellascositas.es/19801-home_default/funko-pop-iron-hammer-866-25-cm-marvel-infinity-warps-special-edition.jpg","35,95 €","Marvel Infinity Warps Figura POP! Vinyl Iron Hammer 25 cm Special Edition"
"MARVEL","Funko POP Wolverine Retro 722 Marvel X-Men Special Edition","https://bellascositas.es/19812-home_default/funko-pop-wolverine-retro-722-marvel-x-men-special-edition.jpg","15,26 €","X-Men POP! Marvel Vinyl Figura Wolverine Special Edition"
"MARVEL","Funko POP Mystique Mistica 638 Marvel X-Men 20th","https://bellascositas.es/8239-home_default/funko-pop-mystique-mistica-638-marvel-x-men-20th.jpg","12,71 €","X-Men 20th Anniversary POP! Marvel Vinyl Figura Mystique 9 cm"
"MARVEL","Llavero Pocket POP Marvel Zombies Magneto","https://bellascositas.es/8468-home_default/llavero-pocket-pop-marvel-zombies-magneto.jpg","5,95 €","Marvel Zombies Llavero Pocket POP! Vinyl Magneto 4 cm"
"MARVEL","Llavero Pocket POP Marvel Zombies Deadpool","https://bellascositas.es/8472-home_default/llavero-pocket-pop-marvel-zombies-deadpool.jpg","5,95 €","Marvel Zombies Llavero Pocket POP! Vinyl Deadpool 4 cm"
"MARVEL","Camiseta Funko Blacklight Marvel Spiderman","https://bellascositas.es/15389-home_default/camiseta-funko-blacklight-marvel-spiderman.jpg","12,71 €","Camiseta Funko Blacklight Marvel Spiderman"
"MARVEL","Funko Camiseta Blacklight Marvel Edición Limitada En Caja","https://bellascositas.es/10463-home_default/funko-camiseta-blacklight-marvel-edicion-limitada-en-caja.jpg","18,66 €","Funko Camiseta Blacklight Marvel Edición Limitada en Caja"
"MARVEL","Funko POP Cyborg Spiderman 723 Marvel Especial Edition","https://bellascositas.es/18575-home_default/funko-pop-cyborg-spiderman-723-marvel-especial-edition.jpg","21,21 €","POP Marvel: Marvel- Cyborg Spider-Man"
"MARVEL","Funko POP Deadpool Slapstick 157 Marvel Comics Rainbow Squad","https://bellascositas.es/13637-home_default/funko-pop-deadpool-slapstick-157-marvel-comics-rainbow-squad.jpg","12,71 €","Marvel Comics POP! Vinyl Figura Deadpool Rainbow Squad Slapstick 9 cm"
"MARVEL","Funko POP Flamenco Deadpool 778 Marvel Comics Deadpool 30th Anniversary","https://bellascositas.es/14042-home_default/funko-pop-flamenco-deadpool-778-marvel-comics-deadpool-30th-anniversary.jpg","11,86 €","Marvel Deadpool 30th Anniversary Figura POP! Vinyl Flamenco Deadpool 9 cm"
"MARVEL","Funko POP Zombie Hulk 659 Marvel Zombies","https://bellascositas.es/19249-home_default/funko-pop-zombie-hulk-659-marvel-zombies.jpg","11,86 €","Marvel Zombies Figura POP! Vinyl Hulk 9 cm"
"MARVEL","Funko POP Gingerbread Capitana Marvel 936 Marvel Holiday","https://bellascositas.es/18013-home_default/funko-pop-gingerbread-capitana-marvel-936-marvel-holiday.jpg","11,86 €","POP Marvel: Holiday - Captain Marvel"
"MARVEL","Funko POP Venomized Punisher 595 Marvel Venom","https://bellascositas.es/6746-home_default/funko-pop-venomized-punisher-595-marvel-venom.jpg","11,86 €","Figuras Pop! Vinyl de tus personajes favoritos de Marvel VENOM VENOMIZED PUNISHER"
"MARVEL","Funko Pop Mystery Box 6 Figuras Marvel","https://bellascositas.es/18710-home_default/funko-pop-mystery-box-6-figuras-marvel.jpg","59,95 €","Caja misteriosa Funko Pop Contiene 6 Figuras Funko POP Aleatorias Marvel de toda la tienda"
"MARVEL","Funko POP Senador Romano Deadpool 779 Marvel Comics Deadpool 30th Anniversary","https://bellascositas.es/14038-home_default/funko-pop-senador-romano-deadpool-779-marvel-comics-deadpool-30th-anniversary.jpg","11,86 €","Marvel Deadpool 30th Anniversary Figura POP! Vinyl Roman Senator Deadpool 9 cm"
"MARVEL","Funko POP Daredevil Venomized 513 Marvel Venom","https://bellascositas.es/4693-home_default/funko-pop-daredevil-venomized-513-marvel-venom.jpg","11,86 €","Para celebrar el 30 Aniversario de VENOM, llega la 2º oleada de Funkos VENOMIZADOS por el simbionte. Funko POP! DAREDEVIL VENOMIZADO."
"MARVEL","Pin Funko POP Iron Man 01 Marvel","https://bellascositas.es/18263-home_default/pin-funko-pop-iron-man-01-marvel.jpg","13,56 €","Pin Iron Man en metal 10 cm. aprox."
"MARVEL","Funko POP Razor Fist 849 Marvel Shang-Chi","https://bellascositas.es/15774-home_default/funko-pop-razor-fist-849-marvel-shang-chi.jpg","11,86 €","Marvel Shang-Chi POP! Marvel Vinyl Figura Razor Fist 9 cm"
"MARVEL","Funko POP T'Challa Star-Lord Metallic 871 Marvel What If Special Edition","https://bellascositas.es/17542-home_default/funko-pop-t-challa-star-lord-metallic-871-marvel-what-if-special-edition.jpg","17,81 €","POP Marvel: What If - T'Challa Star-Lord (Metallic) Special Edition"
"MARVEL","Funko POP Capitán América 497 Marvel 80 Years Special Edition","https://bellascositas.es/15742-home_default/funko-pop-capitan-america-497-marvel-80-years-special-edition.jpg","14,41 €","Marvel 80 Years POP! Vinyl Cabezón Captain America 9 cm Special Edition"
"MARVEL","Funko POP Dane 738 Marvel Eternals","https://bellascositas.es/17929-home_default/funko-pop-dane-738-marvel-eternals.jpg","11,86 €","POP Marvel: Eternals - Dane"
"MARVEL","Funko POP Hulk 635 Avengers Marvel Gamerverse Special Edition","https://bellascositas.es/17424-home_default/funko-pop-hulk-635-avengers-marvel-gamerverse-special-edition.jpg","14,41 €","Marvel's Avengers (2020 video game) POP! Marvel Vinyl Figura Hulk 9 cm Special Edition"
"MARVEL","Funko POP Ghost Panther 860 Marvel Infinity Warps","https://bellascositas.es/16928-home_default/funko-pop-ghost-panther-860-marvel-infinity-warps.jpg","11,86 €","Marvel Infinity Warps Figura POP! Vinyl Ghost Panther 9 cm"
"MARVEL","Funko POP Arachknight 859 Marvel Infinity Warps","https://bellascositas.es/16930-home_default/funko-pop-arachknight-859-marvel-infinity-warps.jpg","11,86 €","Marvel Infinity Warps Figura POP! Vinyl Arachknight 9 cm"
"MARVEL","Funko POP Diamond Patch 861 Marvel Infinity Warps","https://bellascositas.es/16936-home_default/funko-pop-diamond-patch-861-marvel-infinity-warps.jpg","11,86 €","Marvel Infinity Warps Figura POP! Vinyl Diamond Patch 9 cm"
"MARVEL","Funko POP Ultron Venomized 596 Marvel Venom","https://bellascositas.es/6750-home_default/funko-pop-ultron-venomized-596-marvel-venom.jpg","11,86 €","Figuras Pop! Vinyl de tus personajes favoritos de Marvel VENOM VENOMIZED ULTRON"
"MARVEL","Funko POP Miles Morales 2020 Suit 769 Marvel Spiderman Miles Morales","https://bellascositas.es/13584-home_default/funko-pop-miles-morales-2020-suit-769-marvel-spiderman-miles-morales.jpg","11,86 €","Marvel Spiderman Miles Morales POP! Vinyl Figura Miles Morales 2020 Suit 9 cm"
"MARVEL","Funko POP Miles Morales S.T.R.I.K.E. Suit 766 Marvel Spiderman Miles Morales","https://bellascositas.es/13576-home_default/funko-pop-miles-morales-strike-suit-766-marvel-spiderman-miles-morales.jpg","11,86 €","Marvel Spiderman Miles Morales POP! Vinyl Figura Miles Morales S.T.R.I.K.E. Suit 9 cm"
"MARVEL","Funko POP Sharon Carter 816 Marvel The Falcon And The Winter Soldier","https://bellascositas.es/15443-home_default/funko-pop-sharon-carter-816-marvel-the-falcon-and-the-winter-soldier.jpg","11,86 €","The Falcon and the Winter Soldier Figura POP! Vinyl Sharon Carter 9 cm"
"MARVEL","Funko POP Zombie M.O.D.O.K. 791 Marvel Zombies","https://bellascositas.es/13486-home_default/funko-pop-zombie-modok-791-marvel-zombies.jpg","11,86 €","Marvel Zombies POP! Icons Vinyl Figura Zombie Modok 9 cm"
"MARVEL","Funko POP Shang-Chi 844 Marvel Shang-Chi","https://bellascositas.es/15778-home_default/funko-pop-shang-chi-844-marvel-shang-chi.jpg","11,86 €","Marvel Shang-Chi POP! Marvel Vinyl Figura Shang-Chi 9 cm"
"MARVEL","Llavero Pocket POP Wasp Marvel Ant-Man","https://bellascositas.es/6156-home_default/llavero-pocket-pop-wasp-marvel-ant-man.jpg","5,95 €","Ant-Man and the Wasp Llavero Pocket POP! Vinyl Wasp 4 cm"
"MARVEL","Funko POP Larp Deadpool 780 Marvel Comics Deadpool 30th Anniversary","https://bellascositas.es/14050-home_default/funko-pop-larp-deadpool-780-marvel-comics-deadpool-30th-anniversary.jpg","11,86 €","Marvel Deadpool 30th Anniversary Figura POP! Vinyl Nerd Deadpool 9 cm"
"MARVEL","Funko POP Barista Deadpool 775 Marvel Comics Deadpool 30th Anniversary","https://bellascositas.es/14030-home_default/funko-pop-barista-deadpool-775-marvel-comics-deadpool-30th-anniversary.jpg","11,86 €","Marvel Deadpool 30th Anniversary Figura POP! Vinyl Coffee Barista Deadpool 9 cm"
"MARVEL","Funko POP Wade Wilson Weapon XI 489 X-Men Origenes: Lobezno Marvel Exclusive SDCC2020","https://bellascositas.es/11092-home_default/funko-pop-wade-wilson-weapon-xi-489-x-men-origenes-lobezno-marvel-exclusive-sdcc2020.jpg","23,76 €","X-Men Origins: Wolverine - Wade Wilson as Weapon XI Pop! Vinyl Figure (2020 Summer Convention Exclusive) "
"MARVEL","Funko POP Miles Morales Purple Reign Suit Metallic 839 Marvel Spiderman Miles Morales","https://bellascositas.es/15550-home_default/funko-pop-miles-morales-purple-reign-suit-metallic-839-marvel-spiderman-miles-morales.jpg","13,56 €","Marvel Spiderman Miles Morales POP! Vinyl Figura Miles Morales Purple Reign Suit Metallic 9 cm"
"MARVEL","Funko POP M.O.D.O.K. 633 Avengers Marvel Gamerverse","https://bellascositas.es/15543-home_default/funko-pop-modok-633-avengers-marvel-gamerverse.jpg","11,86 €","Marvel's Avengers (2020 video game) POP! Marvel Vinyl Figura MODOK 9 cm"
"MARVEL","Funko POP Zombie Red Hulk 790 Marvel Zombies","https://bellascositas.es/13490-home_default/funko-pop-zombie-red-hulk-790-marvel-zombies.jpg","11,86 €","Marvel Zombies POP! Icons Vinyl Figura Zombie Red Hulk 9 cm"
"MARVEL","Funko POP Zombie Thor 787 Marvel Zombies","https://bellascositas.es/13494-home_default/funko-pop-zombie-thor-787-marvel-zombies.jpg","11,86 €","Marvel Zombies POP! Icons Vinyl Figura Zombie Thor 9 cm"
"MARVEL","Funko POP Zombie Doctor Doom 789 Marvel Zombies","https://bellascositas.es/13482-home_default/funko-pop-zombie-doctor-doom-789-marvel-zombies.jpg","11,86 €","Marvel Zombies POP! Icons Vinyl Figura Zombie Dr. Doom 9 cm"
"MARVEL","Funko POP Miles Morales Programmable Matter Suit 773 Marvel Spiderman Miles Morales","https://bellascositas.es/13572-home_default/funko-pop-miles-morales-programmable-matter-suit-773-marvel-spiderman-miles-morales.jpg","11,86 €","Marvel Spiderman Miles Morales POP! Vinyl Figura Miles Morales Programmable Matter Suit 9 cm"
"MARVEL","Funko POP Miles Morales Classic Suit 765 Spiderman Miles Morales CHASE","https://bellascositas.es/15482-home_default/funko-pop-miles-morales-classic-suit-765-spiderman-miles-morales-chase.jpg","42,46 €","Spiderman Miles Morales Figura POP! Animation Vinyl Spiderman Miles Morales Classic Suit 9 cm Limited Chase Edition"
"MARVEL","Funko POP Thor 452 Los Vengadores Endgame Marvel","https://bellascositas.es/1017-home_default/funko-pop-thor-452-los-vengadores-endgame-marvel.jpg","13,56 €","Figura de Vinilo de 9 cm. aprox. en caja con ventana."
"MARVEL","Funko POP El Venenoide Venom 707 Marvel Luchadores","https://bellascositas.es/14450-home_default/funko-pop-el-venenoide-venom-707-marvel-luchadores.jpg","11,86 €","Marvel Luchadores Figura POP! Vinyl Venom 9 cm"
"MARVEL","Funko POP Zombie La Cosa 665 Marvel Zombies 25 Cm Exclusive SDCC2020","https://bellascositas.es/14352-home_default/funko-pop-zombie-la-cosa-665-marvel-zombies-25-cm-exclusive-sdcc2020.jpg","42,46 €","Marvel Zombies POP! Icons Vinyl Figura Zombie The Thing 25 cmEclusive SDCC 2020"
"MARVEL","Funko POP El Animal Indestructible Wolverine 711 Marvel Luchadores","https://bellascositas.es/13819-home_default/funko-pop-el-animal-indestructible-wolverine-711-marvel-luchadores.jpg","11,86 €","Marvel Luchadores POP! Vinyl Figure Wolverine 9 cm"
"MARVEL","Funko POP El Chimiganga De La Muerte Deadpool 712 Marvel Luchadores","https://bellascositas.es/13815-home_default/funko-pop-el-chimiganga-de-la-muerte-deadpool-712-marvel-luchadores.jpg","11,86 €","Marvel Luchadores POP! Vinyl Figure Deadpool 9 cm"
"MARVEL","Funko POP El Furioso Hulk 708 Marvel Luchadores","https://bellascositas.es/13811-home_default/funko-pop-el-furioso-hulk-708-marvel-luchadores.jpg","11,86 €","Marvel Luchadores POP! Vinyl Figure Hulk 9 cm"
"MARVEL","Llavero Pocket POP Dr. Doom Marvel Zombies","https://bellascositas.es/15493-home_default/llavero-pocket-pop-dr-doom-marvel-zombies.jpg","5,95 €","Llavero Pocket POP Dr. Doom Marvel Zombies"
"MARVEL","Funko POP Doctor Doom 591 Marvel Los 4 Fantásticos Exclusive ECCC2020","https://bellascositas.es/12979-home_default/funko-pop-doctor-doom-591-marvel-los-4-fantasticos-exclusive-eccc2020.jpg","23,76 €","Fantastic Four POP! Marvel Vinyl Figura Doctor Doom 9 cm Exclusive ECCC 2020"
"MARVEL","Funko POP PUNISHER 216 Daredevil Marvel Limited CHASE Edition","https://bellascositas.es/11531-home_default/funko-pop-punisher-216-daredevil-marvel-limited-chase-edition.jpg","42,46 €","Figura Pop! Vinyl de tus personajes favoritos de Marvel Daredevil PUNISHER Limited CHASE Edition"
"DC COMICS","Funko POP Batman 1189 DC The Batman","https://bellascositas.es/20159-home_default/funko-pop-batman-1189-dc-the-batman.jpg","12,71 €","Consigue en Bellascositas el Funko Pop de Batman al mejor precio."
"DC COMICS","Llavero Pocket POP DC The Batman","https://bellascositas.es/20189-home_default/llavero-pocket-pop-dc-the-batman.jpg","5,95 €","Consigue en Bellascositas el Llavero Pocket POP DC The Batman al mejor precio."
"DC COMICS","Funko POP Ride Batman In Batmobile 282 DC The Batman","https://bellascositas.es/20193-home_default/funko-pop-ride-batman-in-batmobile-282-dc-the-batman.jpg","37,36 €","Consigue en Bellascositas el Batman in Batmobile de DC The Batman al mejor precio."
"DC COMICS","Funko POP Batman 01 DC Comics 46 Cm.","https://bellascositas.es/7196-home_default/funko-pop-batman-01-dc-comics-46-cm.jpg","110,46 €","DC Comics Figura Super Sized POP! Heroes Vinyl Batman 46 cm"
"DC COMICS","Funko POP Green Lantern Jessica Cruz 411 DC El Dia De Los Muertos","https://bellascositas.es/19312-home_default/funko-pop-green-lantern-jessica-cruz-411-dc-el-dia-de-los-muertos.jpg","11,86 €","Dia De Los DC Figura POP! Vinyl Green Lantern Jessica 9 cm"
"DC COMICS","Funko POP Green Lantern 400 DC Comics Imperial Palace","https://bellascositas.es/17686-home_default/funko-pop-green-lantern-400-dc-comics-imperial-palace.jpg","11,86 €","POP Heroes: Imperial Palace - Green Lantern"
"DC COMICS","Funko POP Wonder Woman 378 DC Comics Imperial Palace","https://bellascositas.es/17698-home_default/funko-pop-wonder-woman-378-dc-comics-imperial-palace.jpg","11,86 €","POP Heroes: Imperial Palace - Wonder Woman"
"DC COMICS","Funko POP Wonder Woman Ultra Mod Secret Agent 382 DC Comics WW80th","https://bellascositas.es/14422-home_default/funko-pop-wonder-woman-ultra-mod-secret-agent-382-dc-comics-ww80th.jpg","11,86 €","Wonder Woman 80th Anniversary Figura POP! Heroes Vinyl The New WW (1968) 9 cm"
